<?xml version="1.0" encoding="UTF-8"?>
<!-- edited with XMLSpy v2007 (http://www.altova.com) by XMLSpy 2007 Professional Ed., Installed for 43 users (Comvers) -->
<SWIM xmlns:xsi="http://www.w3.org/2001/XMLSchema-instance" xsi:noNamespaceSchemaLocation="D:\DOCUME~1\dkreda\MYDOCU~1\Integration\Projects\SwimConvertor\CAFTests\UAF.xsd">
  <UnitType Name="OMU_Group" Platform="Linux">
    <Install>
      <Component Name="WHC_Service_OMU" ExecutionOrder="210">
<!--This Component has Product Name WHC_FTM_Config_2 with ExecutionPhass 162-->
<!--This Component has Product Name WHC_Compas_Config with ExecutionPhass 210-->
<!--This Component has Product Name WHC_Balancer_Config_OMU with ExecutionPhass 150-->
<!--This Component has Product Name WHC_Fixes with ExecutionPhass 150-->
<!--This Component has Product Name WHC_TCM_Config with ExecutionPhass 150-->
<!--This Component has Product Name Uninstall_Marimba with ExecutionPhass 150-->
<!--This Component has Product Name WHC_FTM_Config_1 with ExecutionPhass 160-->
      </Component>
<!--This Component has Product Name WhoCalled_profile_definition with ExecutionPhass 150-->
      <Component Name="ProfileDefinition_Compas" ExecutionOrder="250"/>
      <Component Name="UpdateTopology" ExecutionOrder="260"/>
    </Install>
    <Parameters>
      <Parameter Name="RunUnit" ComponentName="UpdateTopology" Display="false">
        <Value>{LocalIP}</Value>
      </Parameter>
    </Parameters>
  </UnitType>
</SWIM>
