<?xml version="1.0" encoding="UTF-8"?>
<SWIM xmlns:xsi="http://www.w3.org/2001/XMLSchema-instance" xsi:noNamespaceSchemaLocation="D:\DOCUME~1\galcohe\Desktop\VI_SUITE_SWIM\UAF.xsd">
	<UnitType Name="CAS_Group" Platform="Linux">
		<Install>
			<Component Name="genesis" ExecutionOrder="210">
				<!--This Component has Product Name Genesis-JGlue with ExecutionPhass 210-->
				<!--This Component has Product Name Genesis-BASE with ExecutionPhass 190-->
			</Component>
			<Component Name="mts" ExecutionOrder="170">
				<!--This Component has Product Name MTS with ExecutionPhass 170-->
			</Component>
			<Component Name="um23log" ExecutionOrder="152">
				<!--This Component has Product Name NciLi with ExecutionPhass 152-->
				<!--This Component has Product Name VfpApi with ExecutionPhass 150-->
			</Component>
            <Component Name="VI_AUDIT" ExecutionOrder="4990">
				<!--This Component has Product Name swp-CSPbase-Services with ExecutionPhass 4990-->
				<!--This Component has Product Name change_traceability_params with ExecutionPhass 160-->
				<!--This Component has Product Name enable_disable_traceability with ExecutionPhass 170-->
			</Component>
			<Component Name="VI_CSP-Base_Customization_CAS" ExecutionOrder="110">
				<!--This Component has Product Name VI_CSP-Base_Customization with ExecutionPhass 110-->
				<!--This Component has Product Name VI_CSP-MTA_Custom with ExecutionPhass 110-->
			</Component>
            <Component Name="CSP_Base_Linux" ExecutionOrder="70">
				<!--This Component has Product Name CSPbase_Post_Reboot with ExecutionPhass 70-->
				<!--This Component has Product Name CSPbase with ExecutionPhass 60-->
			</Component>
			<Component Name="vi_j2sdk" ExecutionOrder="100">
				<!--This Component has Product Name JRE_Gen_32bits with ExecutionPhass 100-->
			</Component>
			<Component Name="vi_mta_CAS" ExecutionOrder="252">
				<!--This Component has Product Name MTA_BASE with ExecutionPhass 250-->
				<!--This Component has Product Name MTA_CAS with ExecutionPhass 252-->
			</Component>
			<Component Name="aumsi_CAS" ExecutionOrder="190">
				<!--This Component has Product Name AUMSI with ExecutionPhass 190-->
			</Component>
			<Component Name="Aumsi4Vvm_CAS" ExecutionOrder="190">
				<!--This Component has Product Name IPhoneConfig with ExecutionPhass 190-->
			</Component>
			<Component Name="MTA_Plugin_CAS" ExecutionOrder="550">
				<!--This Component has Product Name MTA_Plugin_CAS with ExecutionPhass 550-->
				<!--This Component has Product Name MTA_Plugin with ExecutionPhass 250-->
			</Component>
			<Component Name="webinbox_CAS" ExecutionOrder="230">
				<!--This Component has Product Name WebInbox-WIS with ExecutionPhass 230-->
			</Component>
			<Component Name="um_utils" ExecutionOrder="150">
				<!--This Component has Product Name UM_UTILS with ExecutionPhass 150-->
			</Component>
			<Component Name="Babysitter" ExecutionOrder="150">
				<!--This Component has Product Name Babysitter with ExecutionPhass 150-->
			</Component>
			<Component Name="service-kit-vi_suite_CAS" ExecutionOrder="3150">
				<!--This Component has Product Name Merge_Tool with ExecutionPhass 150-->
				<!--This Component has Product Name IC-IFS_CAS_Balancer_Farms with ExecutionPhass 2150-->
				<!--This Component has Product Name Platform_Config with ExecutionPhass 2154-->
				<!--This Component has Product Name Maintanenc_Product with ExecutionPhass 150-->
				<!--This Component has Product Name GEN_Customization with ExecutionPhass 2156-->
				<!--This Component has Product Name MTS_Customization_Not_Per_HW with ExecutionPhass 3150-->
				<!--This Component has Product Name Platform_Install with ExecutionPhass 250-->
				<!--This Component has Product Name Service_Config with ExecutionPhass 2152-->
			</Component>
      <Component Name="Reboot" ExecutionOrder="200000">
      </Component>
			<Component Name="service-kit-vi_suite_Balancer" ExecutionOrder="3200">
				<OnlyOn>
					<UnitName>Balancer</UnitName>
				</OnlyOn>
			</Component>
			<Component Name="balancer_MZ" ExecutionOrder="155">
				<OnlyOn>
					<UnitName>Balancer</UnitName>
				</OnlyOn>
			</Component>
			<Component Name="Linux_Hkit" ExecutionOrder="150000">
				<!--This Component has Product Name SEC_AS5_HKIT with ExecutionPhass 150-->
			</Component>
			<Component Name="Tomcat" ExecutionOrder="150">
				<!--This Component has Product Name Tomcat with ExecutionPhass 150-->
			</Component>
      <Component Name="VI_SiteBook_CAS" ExecutionOrder="200">
 <!-- This Component has Product Name create_sitebook_user with ExecutionPhass 330
  --> 
			</Component>
		</Install>
		<Uninstall>
			<Component Name="genesis"/>
			<Component Name="mts"/>
      <Component Name="VI_SiteBook_CAS"/>
			<Component Name="vi_mta_CAS"/>
			<Component Name="aumsi_CAS"/>
			<Component Name="MTA_Plugin_CAS"/>
			<Component Name="webinbox_CAS"/>
			<Component Name="um_utils"/>
			<Component Name="balancer"/>
			<Component Name="Tomcat"/>
		</Uninstall>
		<Parameters>
			<Parameter Name="Unit_Type" ComponentName="genesis" Display="false">
				<Value>CAS</Value>
			</Parameter>
			<Parameter Name="UnitType" ComponentName="MTA_Plugin_CAS" Display="false">
				<Value>CAS</Value>
			</Parameter>
			<Parameter Name="Unit_Type" ComponentName="vi_mta_CAS" Display="false">
				<Value>CAS</Value>
			</Parameter>
			   <Parameter Name="UnitType" ComponentName="vi_mta_CAS" Display="false">
                        </Parameter>
			<Parameter Name="Unit_Type" ComponentName="Babysitter" Display="false">
				<Value>CAS</Value>
			</Parameter>
			<Parameter Name="Unit type" ComponentName="MTA_Plugin_CAS" Display="false">
				<Value>CAS</Value>
			</Parameter>
		</Parameters>
	</UnitType>
</SWIM>
